{
  "schema_version": 1,
  "kind": "ortak_kopru_rafine",
  "observed_at": "2026-10-28T11:11:40Z",
  "observer": "Claude Code Bulut (Hacker odağı)",
  "base_commit": "97c908de7a5850978082770ba3bac3e508688e57",
  "checks": [
    {
      "name": "testler",
      "command": "python -m unittest discover -v",
      "status": "passed",
      "summary": "226 test, 6 atlandı (PowerShell 7 yok)",
      "phase": "before"
    },
    {
      "name": "depo",
      "command": "python tools/depo_kontrol.py",
      "status": "passed",
      "summary": "43 Python, 12 JSON; 179 kayıt tutarlı",
      "phase": "before"
    },
    {
      "name": "okuma",
      "command": "python tools/okuma_yayini_uret.py --check",
      "status": "passed",
      "summary": "beş sayfa kaynaklarıyla bayt-özdeş",
      "phase": "before"
    },
    {
      "name": "kayit-denetimi",
      "command": "python kopru_ekle.py kopru.html --kontrol",
      "status": "passed",
      "summary": "179 kayıt, son k-0179",
      "phase": "before"
    },
    {
      "name": "arayuz",
      "command": "node --check ui/deus/app.js",
      "status": "passed",
      "phase": "before"
    },
    {
      "name": "gonderim",
      "command": "bash -n .github/scripts/kopru_gonder.sh",
      "status": "passed",
      "phase": "before"
    },
    {
      "name": "powershell",
      "command": "pwsh ayrıştırma ve tests/test_powershell.py",
      "status": "skipped",
      "summary": "pwsh bu ortamda yok; indirilen ikilinin çalıştırılmasına izin verilmedi",
      "phase": "before"
    },
    {
      "name": "baglantilar",
      "command": "python3 -I link_audit.py (geçici betik, depoya girmedi)",
      "status": "passed",
      "summary": "702 bağlantı, 275 çapa; kırık yok",
      "phase": "before"
    },
    {
      "name": "testler",
      "command": "python -m unittest discover -v",
      "status": "passed",
      "summary": "254 test, 6 atlandı (PowerShell 7 yok)",
      "phase": "after"
    },
    {
      "name": "dogrula",
      "command": "python tools/dogrula.py",
      "status": "passed",
      "summary": "6 tamam, 0 başarısız, 1 atlandı (powershell)",
      "phase": "after"
    },
    {
      "name": "semalar",
      "command": "python tools/sema_denetle.py",
      "status": "passed",
      "summary": "7 şema desteklenen alt kümede",
      "phase": "after"
    },
    {
      "name": "ci-windows-ilk",
      "command": "GitHub Actions dogrulama.yml windows-latest (PR #23, ilk koşu)",
      "status": "failed",
      "summary": "sema_denetle.py cp1252 konsolunda UnicodeEncodeError; bash WSL başlatıcısına çıktı. PowerShell ayrıştırması ve 6 PowerShell testi geçti.",
      "phase": "after"
    },
    {
      "name": "ci-windows",
      "command": "GitHub Actions dogrulama.yml windows-latest (PR #23, run 40677675884)",
      "status": "passed",
      "summary": "6 tamam, 0 başarısız, 1 atlandı (gonderim; Linux denetler); testler OK, 9 atlandı",
      "phase": "after"
    },
    {
      "name": "ci-ubuntu",
      "command": "GitHub Actions dogrulama.yml ubuntu-latest (PR #23, run 40677675884)",
      "status": "passed",
      "summary": "7 tamam, 0 başarısız, 0 atlandı; PowerShell ayrıştırması ve testleri dahil",
      "phase": "after"
    }
  ],
  "findings": [
    {
      "id": "R-01",
      "severity": "orta",
      "area": "sözleşme",
      "location": "schemas/*.schema.json",
      "claim": "Altı JSON sözleşmesini hiçbir kod veya test okumuyordu; şema ile kodun ayrışması fark edilemezdi.",
      "evidence": "grep -rn 'schemas/' ve '$schema' araması src, tests, tools ve kök betiklerde boş döndü.",
      "resolution": "düzeltildi",
      "change": "tools/sema_denetle.py (standart kütüphaneyle alt küme denetleyicisi) ve tests/test_semalar.py (çekirdeğin ürettiği iş, olay, denetim, atama, devir ve aktarım nesneleri sözleşmelere karşı).",
      "note": "Kod ile sözleşmeler arasında sapma bulunmadı; bulgu, sapmanın görünmez olmasıydı."
    },
    {
      "id": "R-02",
      "severity": "orta",
      "area": "iş akışı",
      "location": "README.md, docs/BAKIM.md, .github/pull_request_template.md, .github/workflows/dogrulama.yml",
      "claim": "Belgelerdeki yerel doğrulama iki komut veriyordu; CI beş ayrı kontrol koşuyordu.",
      "evidence": "dogrulama.yml ayrıca okuma_yayini_uret.py --check, node --check ve Bash/PowerShell sözdizimi adımlarını içeriyordu.",
      "resolution": "düzeltildi",
      "change": "tools/dogrula.py tek listeyi yerelde ve CI'da aynı sırayla koşar; dogrulama.yml bu komutu çağırır; belgeler ve PR şablonu güncellendi."
    },
    {
      "id": "R-03",
      "severity": "orta",
      "area": "kod",
      "location": "kopru_ekle.py:32",
      "claim": "IP deseni harf veya tireyle bitişik dört parçalı sürüm adlarını (Git-Portable-2.56.0.2) IP sayıp kaydı reddediyordu.",
      "evidence": "yasak_kontrol('Git-Portable-2.56.0.2') → ['IP adresi']; ad ayarlar-yerel.json'da ve kayit/ günlüklerinin 24'ünde geçiyor.",
      "resolution": "düzeltildi",
      "change": "Geri bakış [\\w.-] ile genişletildi, sekizliler 0-255 ile sınırlandı; gerçek adresler (@, :, parantez, boşluk sonrası) yakalanmaya devam ediyor.",
      "note": "Boşlukla ayrılmış ve 0-255 aralığında dört parçalı sürüm (3.14.9.1) bağlamsız IP'den ayırt edilemediği için hâlâ reddedilir; test bu sınırı açıkça sabitler."
    },
    {
      "id": "R-04",
      "severity": "orta",
      "area": "kod",
      "location": "kopru_ekle.py:69-80 dis_yukleme_kontrol",
      "claim": "'Sayfa dış hiçbir şey yüklemez' denetimi modulepreload/preload bağlantıları, srcset, poster, data, action/formaction, @import ve meta refresh ile aşılabiliyordu.",
      "evidence": "Yedi sentetik parça eski denetimden boş sonuçla geçti.",
      "resolution": "düzeltildi",
      "change": "Yükleme yapan link türleri, ek nitelikler, @import ve meta refresh denetime eklendi; kanonik sayfa yeni kurallarla da geçiyor."
    },
    {
      "id": "R-05",
      "severity": "orta",
      "area": "kod",
      "location": "kopru_bolum_ekle.py",
      "claim": "Bölüm parçası hiçbir dış yükleme veya yasak desen denetiminden geçmeden kanonik sayfaya yazılıyordu.",
      "evidence": "Betik yalnız sarmalayıcı biçimine bakıyordu; kayıt ekleyicinin denetimleri çağrılmıyordu.",
      "resolution": "düzeltildi",
      "change": "Parça yazılmadan önce dis_yukleme_kontrol ve yasak_kontrol'den geçer; takılırsa sayfa değişmez."
    },
    {
      "id": "R-06",
      "severity": "düşük",
      "area": "kod",
      "location": "kopru_ekle.py:33",
      "claim": "UUID deseni yalnız küçük harfi yakalıyordu; Windows'ta yaygın büyük harfli GUID'ler geçiyordu.",
      "evidence": "yasak_kontrol('550E8400-E29B-41D4-A716-446655440000') → [].",
      "resolution": "düzeltildi",
      "change": "Desen büyük/küçük harfe duyarsız yapıldı."
    },
    {
      "id": "R-07",
      "severity": "düşük",
      "area": "kod",
      "location": "kopru_yanitla.py --yalniz",
      "claim": "Ayarda olmayan katılımcı adı sessizce hiçbir şey yapmadan başarıyla dönüyordu (Tek Copilot, Izle 10).",
      "evidence": "--yalniz Copilot ile ayarlar.json: 'eklenen: yok', çıkış 0.",
      "resolution": "düzeltildi",
      "change": "Bilinmeyen ad geçerli adları sayan bir hatayla çıkış 1 verir."
    },
    {
      "id": "R-08",
      "severity": "düşük",
      "area": "kod",
      "location": "kopru_yanitla.py bolum_metni",
      "claim": "İstem metni yalnız dört HTML varlığını çözüyordu; &#x27; gibi varlıklar modele ham gidiyordu.",
      "evidence": "Sayfa html.escape çıktısı olarak &#x27; içeriyor.",
      "resolution": "düzeltildi",
      "change": "html.unescape kullanılıyor."
    },
    {
      "id": "R-09",
      "severity": "orta",
      "area": "yapılandırma",
      "location": "ayarlar.json Claude CLI yolu",
      "claim": "Bulutta 'Claude (Max)' imzalı CLI alt sürecine ANTHROPIC_API_KEY, OPENAI_API_KEY ve GEMINI_API_KEY de geçiyordu.",
      "evidence": "cli_cagir ortamı dict(os.environ) ile kurar; kopru.yml dört gizli değeri aynı adıma verir.",
      "resolution": "düzeltildi",
      "change": "Var olan ortam: null mekanizmasıyla bu üç değişken CLI sürecinden kaldırıldı; API yedeği kendi imzasıyla ayrı çalışmaya devam eder.",
      "note": "CLI'nın iki kimlik bilgisi birlikte verildiğinde hangisini seçtiği bu turda gözlenmedi; değişiklik bu belirsizliği ortadan kaldırır."
    },
    {
      "id": "R-10",
      "severity": "düşük",
      "area": "iş akışı",
      "location": "tools/dogrula.py powershell kontrolü",
      "claim": "PowerShell sözdizimi denetimi yalnız kök dizindeki .ps1 dosyalarını kapsıyordu; windows/nt/build.ps1 dışarıda kalıyordu.",
      "evidence": "Get-ChildItem -LiteralPath . -Filter *.ps1 özyinelemesizdi.",
      "resolution": "düzeltildi",
      "change": "Denetim .git dışındaki bütün alt dizinleri kapsar.",
      "note": "Bu oturumda pwsh çalıştırılamadı; PR #23'ün Windows ve Ubuntu CI koşuları (run 40677675884) genişletilmiş ayrıştırmanın windows/nt/build.ps1 dahil geçtiğini gösterdi."
    },
    {
      "id": "R-11",
      "severity": "düşük",
      "area": "kod",
      "location": "src/ortak_kopru/backup.py:16, src/ortak_kopru/exchange.py:23",
      "claim": "Kullanılmayan iki içe aktarma (Path, LocalFileError).",
      "evidence": "AST taraması; başka modül bu adları exchange'den almıyor.",
      "resolution": "düzeltildi",
      "change": "İki içe aktarma kaldırıldı."
    },
    {
      "id": "R-12",
      "severity": "düşük",
      "area": "belge",
      "location": "docs/SON_DURUM.md:27",
      "claim": "Statik sayfalar dört diye sayılıyordu; mimari defteri dahil beş sayfa var.",
      "evidence": "tools/okuma_yayini_uret.py PAGES beş girdi taşır.",
      "resolution": "düzeltildi",
      "change": "Beş sayfa ve ortak üretici belirtildi."
    },
    {
      "id": "R-13",
      "severity": "düşük",
      "area": "belge",
      "location": "docs/BAKIM.md GitHub Actions",